{"schema_name":"rendered-text-object-inventory","schema_version":"1.0.0","activation_status":"target_only","final_pdf_sha256":"1111111111111111111111111111111111111111111111111111111111111111","extractor_suite":[{"extractor_id":"pdf-text-v1","extractor_sha256":"2222222222222222222222222222222222222222222222222222222222222222"}],"coverage":{"page_count":1,"pages_scanned":[1],"content_streams_complete":true,"annotations_complete":true,"form_xobjects_complete":true,"declared_raster_text_complete":true},"objects":[{"object_id":"p1.text.1","page":1,"object_kind":"pdf_text_run","bbox":[0,0,1,1],"exact_utf8_text":"example","text_sha256":"3333333333333333333333333333333333333333333333333333333333333333","extractor_id":"pdf-text-v1","evidence_locator":"page:1/object:1","object_sha256":"4444444444444444444444444444444444444444444444444444444444444444"}],"inventory_sha256":"5555555555555555555555555555555555555555555555555555555555555555"}
